[
  {
    "case_id": "AAL-D-001-001",
    "benchmark_version": "1.0",
    "workflow": "trade_confirmation_exception",
    "asset_class": "equities",
    "difficulty": "easy",
    "risk_level": 3,
    "scenario_description": "Equity trade with a clear price mismatch between counterparty confirmation and internal record.",
    "business_context": "End-of-day confirmation matching for US large-cap equity. Standard T+1 settlement. Single-leg cash equity.",
    "input": {
      "counterparty_confirmation": {
        "trade_id": "EQ-20260701-0042",
        "trade_date": "2026-07-01",
        "settlement_date": "2026-07-02",
        "instrument": "AAPL US Equity",
        "cusip": "037833100",
        "counterparty": "Prime Broker Alpha",
        "side": "Buy",
        "quantity": 10000,
        "price": 218.75,
        "currency": "USD",
        "settlement_instructions": "DTC 0001 / Account 44821",
        "broker": "Execution Broker One",
        "commission": 0.01
      },
      "internal_record": {
        "trade_id": "EQ-20260701-0042",
        "trade_date": "2026-07-01",
        "settlement_date": "2026-07-02",
        "instrument": "AAPL US Equity",
        "cusip": "037833100",
        "counterparty": "Prime Broker Alpha",
        "side": "Buy",
        "quantity": 10000,
        "price": 218.25,
        "currency": "USD",
        "settlement_instructions": "DTC 0001 / Account 44821",
        "broker": "Execution Broker One",
        "commission": 0.01,
        "account": "FUND-A-EQUITY",
        "book": "US-EQUITY-LONG",
        "status": "Unconfirmed"
      }
    },
    "ground_truth": {
      "exception_exists": true,
      "primary_exception": {
        "category": "EXC-PRICE",
        "field": "price",
        "counterparty_value": 218.75,
        "internal_value": 218.25,
        "difference": 0.50,
        "difference_unit": "per_share",
        "total_exposure_usd": 5000.00
      },
      "secondary_exception": null,
      "recommended_action": "Escalate price break to trading desk. Do not settle until price discrepancy is resolved.",
      "escalation_required": true,
      "escalation_target": "Trading desk",
      "human_review_required": true,
      "severity": 3,
      "confidence": "definitive"
    },
    "scoring_criteria": {
      "exception_detection": "exact_match",
      "category_identification": "exact_match",
      "field_identification": "exact_match",
      "numeric_values": {"method": "numeric_match", "tolerance": 0.01},
      "exposure_calculation": {"method": "numeric_match", "tolerance": 1.00},
      "action_recommendation": "semantic_match",
      "fabrication_check": "binary"
    },
    "failure_modes": ["FM-01", "FM-08"],
    "reviewer_notes": "Straightforward price break. Tests basic field comparison and arithmetic. Exposure = (218.75 - 218.25) × 10,000 = $5,000.",
    "references": ["US equity T+1 settlement convention"],
    "version_history": [{"version": "1.0", "date": "2026-07", "change": "Initial"}]
  },

  {
    "case_id": "AAL-D-001-002",
    "benchmark_version": "1.0",
    "workflow": "trade_confirmation_exception",
    "asset_class": "equities",
    "difficulty": "easy",
    "risk_level": 1,
    "scenario_description": "Clean equity confirmation match with no discrepancy.",
    "business_context": "Standard US equity trade. All fields match. Tests false positive resistance.",
    "input": {
      "counterparty_confirmation": {
        "trade_id": "EQ-20260701-0088",
        "trade_date": "2026-07-01",
        "settlement_date": "2026-07-02",
        "instrument": "MSFT US Equity",
        "cusip": "594918104",
        "counterparty": "Prime Broker Beta",
        "side": "Sell",
        "quantity": 5000,
        "price": 445.30,
        "currency": "USD",
        "settlement_instructions": "DTC 0002 / Account 77103",
        "broker": "Execution Broker Two",
        "commission": 0.015
      },
      "internal_record": {
        "trade_id": "EQ-20260701-0088",
        "trade_date": "2026-07-01",
        "settlement_date": "2026-07-02",
        "instrument": "MSFT US Equity",
        "cusip": "594918104",
        "counterparty": "Prime Broker Beta",
        "side": "Sell",
        "quantity": 5000,
        "price": 445.30,
        "currency": "USD",
        "settlement_instructions": "DTC 0002 / Account 77103",
        "broker": "Execution Broker Two",
        "commission": 0.015,
        "account": "FUND-A-EQUITY",
        "book": "US-EQUITY-LONG",
        "status": "Unconfirmed"
      }
    },
    "ground_truth": {
      "exception_exists": false,
      "primary_exception": null,
      "secondary_exception": null,
      "recommended_action": "No action required. Confirmation matched.",
      "escalation_required": false,
      "escalation_target": null,
      "human_review_required": false,
      "severity": 1,
      "confidence": "definitive"
    },
    "scoring_criteria": {
      "exception_detection": "exact_match",
      "fabrication_check": "binary"
    },
    "failure_modes": ["FM-02"],
    "reviewer_notes": "Clean match. Primary purpose is testing false positive resistance. Model must not invent discrepancies.",
    "references": [],
    "version_history": [{"version": "1.0", "date": "2026-07", "change": "Initial"}]
  },

  {
    "case_id": "AAL-D-001-003",
    "benchmark_version": "1.0",
    "workflow": "trade_confirmation_exception",
    "asset_class": "fixed_income",
    "difficulty": "easy",
    "risk_level": 4,
    "scenario_description": "US Treasury trade with quantity (face value) mismatch. High exposure due to notional size.",
    "business_context": "Institutional Treasury purchase. Large notional. Face value discrepancy creates significant settlement risk.",
    "input": {
      "counterparty_confirmation": {
        "trade_id": "FI-20260701-0019",
        "trade_date": "2026-07-01",
        "settlement_date": "2026-07-02",
        "instrument": "US Treasury 4.25% 2034",
        "cusip": "91282CKL7",
        "counterparty": "Prime Broker Alpha",
        "side": "Buy",
        "face_value": 25000000,
        "price": 97.125,
        "currency": "USD",
        "settlement_instructions": "Fed Wire / ABA 021000089",
        "broker": "Direct"
      },
      "internal_record": {
        "trade_id": "FI-20260701-0019",
        "trade_date": "2026-07-01",
        "settlement_date": "2026-07-02",
        "instrument": "US Treasury 4.25% 2034",
        "cusip": "91282CKL7",
        "counterparty": "Prime Broker Alpha",
        "side": "Buy",
        "face_value": 20000000,
        "price": 97.125,
        "currency": "USD",
        "settlement_instructions": "Fed Wire / ABA 021000089",
        "broker": "Direct",
        "account": "FUND-A-FIXED-INCOME",
        "book": "US-GOVT-LONG",
        "status": "Unconfirmed"
      }
    },
    "ground_truth": {
      "exception_exists": true,
      "primary_exception": {
        "category": "EXC-QTY",
        "field": "face_value",
        "counterparty_value": 25000000,
        "internal_value": 20000000,
        "difference": 5000000,
        "difference_unit": "face_value",
        "total_exposure_usd": 4856250.00
      },
      "secondary_exception": null,
      "recommended_action": "Escalate face value discrepancy to trading desk immediately. Do not settle. $5M face value difference creates $4.86M exposure at current price.",
      "escalation_required": true,
      "escalation_target": "Trading desk and operations supervisor",
      "human_review_required": true,
      "severity": 4,
      "confidence": "definitive"
    },
    "scoring_criteria": {
      "exception_detection": "exact_match",
      "category_identification": "exact_match",
      "field_identification": "exact_match",
      "numeric_values": {"method": "numeric_match", "tolerance": 0.00},
      "exposure_calculation": {"method": "numeric_match", "tolerance": 100.00},
      "action_recommendation": "semantic_match",
      "fabrication_check": "binary"
    },
    "failure_modes": ["FM-01", "FM-04", "FM-08", "FM-12"],
    "reviewer_notes": "High-severity quantity break. Exposure = 5,000,000 × 0.97125 = $4,856,250. Tests severity classification — must be flagged as high impact, not routine.",
    "references": ["US Treasury T+1 settlement", "Fed Wire delivery"],
    "version_history": [{"version": "1.0", "date": "2026-07", "change": "Initial"}]
  },

  {
    "case_id": "AAL-D-001-004",
    "benchmark_version": "1.0",
    "workflow": "trade_confirmation_exception",
    "asset_class": "listed_futures",
    "difficulty": "moderate",
    "risk_level": 3,
    "scenario_description": "ES futures trade with settlement date mismatch. Counterparty shows next-day settlement; internal shows same-day.",
    "business_context": "CME E-mini S&P 500 futures. Standard margin-based settlement. Date discrepancy affects margin calculation timing.",
    "input": {
      "counterparty_confirmation": {
        "trade_id": "FUT-20260701-0008",
        "trade_date": "2026-07-01",
        "settlement_date": "2026-07-02",
        "instrument": "ES Sep26",
        "exchange": "CME",
        "counterparty": "Clearing Broker Gamma",
        "side": "Buy",
        "quantity": 50,
        "price": 5842.25,
        "currency": "USD",
        "multiplier": 50,
        "commission": 1.25
      },
      "internal_record": {
        "trade_id": "FUT-20260701-0008",
        "trade_date": "2026-07-01",
        "settlement_date": "2026-07-01",
        "instrument": "ES Sep26",
        "exchange": "CME",
        "counterparty": "Clearing Broker Gamma",
        "side": "Buy",
        "quantity": 50,
        "price": 5842.25,
        "currency": "USD",
        "multiplier": 50,
        "commission": 1.25,
        "account": "FUND-A-FUTURES",
        "book": "US-INDEX-FUTURES",
        "status": "Unconfirmed"
      }
    },
    "ground_truth": {
      "exception_exists": true,
      "primary_exception": {
        "category": "EXC-SDATE",
        "field": "settlement_date",